<?xml version="1.0" encoding="UTF-8"?>
<!DOCTYPE alphabet SYSTEM "../alphabet.dtd">
<alphabet name="Kashmiri (WorldAlphabets)" orientation="RL" trainingFilename="training_wa_ks_Arab.txt" colorsName="Default">
  <group name="Lower case" colorInfoName="lower case">
    <node label="ء">
      <textCharAction />
    </node>
    <node label="آ">
      <textCharAction />
    </node>
    <node label="أ">
      <textCharAction />
    </node>
    <node label="ٲ">
      <textCharAction />
    </node>
    <node label="ؤ">
      <textCharAction />
    </node>
    <node label="ا">
      <textCharAction />
    </node>
    <node label="ب">
      <textCharAction />
    </node>
    <node label="پ">
      <textCharAction />
    </node>
    <node label="ت">
      <textCharAction />
    </node>
    <node label="ث">
      <textCharAction />
    </node>
    <node label="ٹ">
      <textCharAction />
    </node>
    <node label="ج">
      <textCharAction />
    </node>
    <node label="چ">
      <textCharAction />
    </node>
    <node label="ح">
      <textCharAction />
    </node>
    <node label="خ">
      <textCharAction />
    </node>
    <node label="د">
      <textCharAction />
    </node>
    <node label="ذ">
      <textCharAction />
    </node>
    <node label="ڈ">
      <textCharAction />
    </node>
    <node label="ر">
      <textCharAction />
    </node>
    <node label="ز">
      <textCharAction />
    </node>
    <node label="ڑ">
      <textCharAction />
    </node>
    <node label="ژ">
      <textCharAction />
    </node>
    <node label="س">
      <textCharAction />
    </node>
    <node label="ش">
      <textCharAction />
    </node>
    <node label="ص">
      <textCharAction />
    </node>
    <node label="ض">
      <textCharAction />
    </node>
    <node label="ط">
      <textCharAction />
    </node>
    <node label="ظ">
      <textCharAction />
    </node>
    <node label="ع">
      <textCharAction />
    </node>
    <node label="غ">
      <textCharAction />
    </node>
    <node label="ف">
      <textCharAction />
    </node>
    <node label="ق">
      <textCharAction />
    </node>
    <node label="ک">
      <textCharAction />
    </node>
    <node label="گ">
      <textCharAction />
    </node>
    <node label="ل">
      <textCharAction />
    </node>
    <node label="م">
      <textCharAction />
    </node>
    <node label="ن">
      <textCharAction />
    </node>
    <node label="ں">
      <textCharAction />
    </node>
    <node label="ھ">
      <textCharAction />
    </node>
    <node label="ہ">
      <textCharAction />
    </node>
    <node label="و">
      <textCharAction />
    </node>
    <node label="ۄ">
      <textCharAction />
    </node>
    <node label="ۆ">
      <textCharAction />
    </node>
    <node label="ی">
      <textCharAction />
    </node>
    <node label="ؠ">
      <textCharAction />
    </node>
    <node label="ے">
      <textCharAction />
    </node>
  </group>
  <group name="Upper case" colorInfoName="upper case">
    <node label="ء">
      <textCharAction />
    </node>
    <node label="آ">
      <textCharAction />
    </node>
    <node label="أ">
      <textCharAction />
    </node>
    <node label="ٲ">
      <textCharAction />
    </node>
    <node label="ؤ">
      <textCharAction />
    </node>
    <node label="ا">
      <textCharAction />
    </node>
    <node label="ب">
      <textCharAction />
    </node>
    <node label="پ">
      <textCharAction />
    </node>
    <node label="ت">
      <textCharAction />
    </node>
    <node label="ث">
      <textCharAction />
    </node>
    <node label="ٹ">
      <textCharAction />
    </node>
    <node label="ج">
      <textCharAction />
    </node>
    <node label="چ">
      <textCharAction />
    </node>
    <node label="ح">
      <textCharAction />
    </node>
    <node label="خ">
      <textCharAction />
    </node>
    <node label="د">
      <textCharAction />
    </node>
    <node label="ذ">
      <textCharAction />
    </node>
    <node label="ڈ">
      <textCharAction />
    </node>
    <node label="ر">
      <textCharAction />
    </node>
    <node label="ز">
      <textCharAction />
    </node>
    <node label="ڑ">
      <textCharAction />
    </node>
    <node label="ژ">
      <textCharAction />
    </node>
    <node label="س">
      <textCharAction />
    </node>
    <node label="ش">
      <textCharAction />
    </node>
    <node label="ص">
      <textCharAction />
    </node>
    <node label="ض">
      <textCharAction />
    </node>
    <node label="ط">
      <textCharAction />
    </node>
    <node label="ظ">
      <textCharAction />
    </node>
    <node label="ع">
      <textCharAction />
    </node>
    <node label="غ">
      <textCharAction />
    </node>
    <node label="ف">
      <textCharAction />
    </node>
    <node label="ق">
      <textCharAction />
    </node>
    <node label="ک">
      <textCharAction />
    </node>
    <node label="گ">
      <textCharAction />
    </node>
    <node label="ل">
      <textCharAction />
    </node>
    <node label="م">
      <textCharAction />
    </node>
    <node label="ن">
      <textCharAction />
    </node>
    <node label="ں">
      <textCharAction />
    </node>
    <node label="ھ">
      <textCharAction />
    </node>
    <node label="ہ">
      <textCharAction />
    </node>
    <node label="و">
      <textCharAction />
    </node>
    <node label="ۄ">
      <textCharAction />
    </node>
    <node label="ۆ">
      <textCharAction />
    </node>
    <node label="ی">
      <textCharAction />
    </node>
    <node label="ؠ">
      <textCharAction />
    </node>
    <node label="ے">
      <textCharAction />
    </node>
  </group>
  <group name="paragraphSpace" colorInfoName="paragraphSpace">
    <node label="¶" text="&#10;">
      <textCharAction />
    </node>
    <node label="␣" text=" ">
      <textCharAction />
    </node>
  </group>
  <group name="Editing" colorInfoName="editing">
    <node label="⌫">
      <deleteTextAction distance="last char" />
    </node>
    <node label="⌦">
      <deleteTextAction distance="next char" />
    </node>
    <node label="⌫ Word">
      <deleteTextAction distance="last word" />
    </node>
  </group>
</alphabet>