<?xml version="1.0" encoding="UTF-8"?>
<!DOCTYPE alphabet SYSTEM "../alphabet.dtd">
<alphabet name="Quechua (WorldAlphabets)" orientation="LR" trainingFilename="training_wa_qu_Latn.txt" colorsName="Default">
  <group name="Lower case" colorInfoName="lower case">
    <node label="a">
      <textCharAction />
    </node>
    <node label="c">
      <textCharAction />
    </node>
    <node label="h">
      <textCharAction />
    </node>
    <node label="i">
      <textCharAction />
    </node>
    <node label="k">
      <textCharAction />
    </node>
    <node label="l">
      <textCharAction />
    </node>
    <node label="m">
      <textCharAction />
    </node>
    <node label="n">
      <textCharAction />
    </node>
    <node label="ñ">
      <textCharAction />
    </node>
    <node label="p">
      <textCharAction />
    </node>
    <node label="q">
      <textCharAction />
    </node>
    <node label="s">
      <textCharAction />
    </node>
    <node label="t">
      <textCharAction />
    </node>
    <node label="u">
      <textCharAction />
    </node>
    <node label="w">
      <textCharAction />
    </node>
    <node label="y">
      <textCharAction />
    </node>
    <node label="ʼ">
      <textCharAction />
    </node>
  </group>
  <group name="Upper case" colorInfoName="upper case">
    <node label="A">
      <textCharAction />
    </node>
    <node label="C">
      <textCharAction />
    </node>
    <node label="H">
      <textCharAction />
    </node>
    <node label="I">
      <textCharAction />
    </node>
    <node label="K">
      <textCharAction />
    </node>
    <node label="L">
      <textCharAction />
    </node>
    <node label="M">
      <textCharAction />
    </node>
    <node label="N">
      <textCharAction />
    </node>
    <node label="Ñ">
      <textCharAction />
    </node>
    <node label="P">
      <textCharAction />
    </node>
    <node label="Q">
      <textCharAction />
    </node>
    <node label="S">
      <textCharAction />
    </node>
    <node label="T">
      <textCharAction />
    </node>
    <node label="U">
      <textCharAction />
    </node>
    <node label="W">
      <textCharAction />
    </node>
    <node label="Y">
      <textCharAction />
    </node>
    <node label="ʼ">
      <textCharAction />
    </node>
  </group>
  <group name="paragraphSpace" colorInfoName="paragraphSpace">
    <node label="¶" text="&#10;">
      <textCharAction />
    </node>
    <node label="␣" text=" ">
      <textCharAction />
    </node>
  </group>
  <group name="Editing" colorInfoName="editing">
    <node label="⌫">
      <deleteTextAction distance="last char" />
    </node>
    <node label="⌦">
      <deleteTextAction distance="next char" />
    </node>
    <node label="⌫ Word">
      <deleteTextAction distance="last word" />
    </node>
  </group>
</alphabet>