<?xml version="1.0" encoding="UTF-8"?>
<!DOCTYPE alphabet SYSTEM "../alphabet.dtd">
<alphabet name="Igbo (WorldAlphabets)" orientation="LR" trainingFilename="" colorsName="Default">
  <group name="Lower case" colorInfoName="lowercase">
    <node label="a">
      <textCharAction />
    </node>
    <node label="b">
      <textCharAction />
    </node>
    <node label="d">
      <textCharAction />
    </node>
    <node label="e">
      <textCharAction />
    </node>
    <node label="ẹ">
      <textCharAction />
    </node>
    <node label="f">
      <textCharAction />
    </node>
    <node label="g">
      <textCharAction />
    </node>
    <node label="h">
      <textCharAction />
    </node>
    <node label="i">
      <textCharAction />
    </node>
    <node label="ị">
      <textCharAction />
    </node>
    <node label="j">
      <textCharAction />
    </node>
    <node label="k">
      <textCharAction />
    </node>
    <node label="l">
      <textCharAction />
    </node>
    <node label="m">
      <textCharAction />
    </node>
    <node label="n">
      <textCharAction />
    </node>
    <node label="ṅ">
      <textCharAction />
    </node>
    <node label="o">
      <textCharAction />
    </node>
    <node label="ọ">
      <textCharAction />
    </node>
    <node label="p">
      <textCharAction />
    </node>
    <node label="r">
      <textCharAction />
    </node>
    <node label="s">
      <textCharAction />
    </node>
    <node label="t">
      <textCharAction />
    </node>
    <node label="u">
      <textCharAction />
    </node>
    <node label="ụ">
      <textCharAction />
    </node>
    <node label="v">
      <textCharAction />
    </node>
    <node label="w">
      <textCharAction />
    </node>
    <node label="y">
      <textCharAction />
    </node>
    <node label="z">
      <textCharAction />
    </node>
  </group>
  <group name="Upper case" colorInfoName="uppercase">
    <node label="A">
      <textCharAction />
    </node>
    <node label="B">
      <textCharAction />
    </node>
    <node label="D">
      <textCharAction />
    </node>
    <node label="E">
      <textCharAction />
    </node>
    <node label="Ẹ">
      <textCharAction />
    </node>
    <node label="F">
      <textCharAction />
    </node>
    <node label="G">
      <textCharAction />
    </node>
    <node label="H">
      <textCharAction />
    </node>
    <node label="I">
      <textCharAction />
    </node>
    <node label="Ị">
      <textCharAction />
    </node>
    <node label="J">
      <textCharAction />
    </node>
    <node label="K">
      <textCharAction />
    </node>
    <node label="L">
      <textCharAction />
    </node>
    <node label="M">
      <textCharAction />
    </node>
    <node label="N">
      <textCharAction />
    </node>
    <node label="Ṅ">
      <textCharAction />
    </node>
    <node label="O">
      <textCharAction />
    </node>
    <node label="Ọ">
      <textCharAction />
    </node>
    <node label="P">
      <textCharAction />
    </node>
    <node label="R">
      <textCharAction />
    </node>
    <node label="S">
      <textCharAction />
    </node>
    <node label="T">
      <textCharAction />
    </node>
    <node label="U">
      <textCharAction />
    </node>
    <node label="Ụ">
      <textCharAction />
    </node>
    <node label="V">
      <textCharAction />
    </node>
    <node label="W">
      <textCharAction />
    </node>
    <node label="Y">
      <textCharAction />
    </node>
    <node label="Z">
      <textCharAction />
    </node>
  </group>
  <group name="paragraphSpace" colorInfoName="paragraphSpace">
    <node label="¶" text="&#10;">
      <textCharAction />
    </node>
    <node label="␣" text=" ">
      <textCharAction />
    </node>
  </group>
  <group name="Editing" colorInfoName="punctuation">
    <node label="⌫">
      <deleteTextAction distance="last char" />
    </node>
    <node label="⌦">
      <deleteTextAction distance="next char" />
    </node>
    <node label="⌫ Word">
      <deleteTextAction distance="last word" />
    </node>
  </group>
</alphabet>