<?xml version="1.0" encoding="UTF-8"?>
<!DOCTYPE alphabet SYSTEM "../alphabet.dtd">
<alphabet name="Ukrainian (WorldAlphabets)" orientation="LR" trainingFilename="training_wa_uk_Cyrl.txt" colorsName="Default">
  <group name="Lower case" colorInfoName="lower case">
    <node label="а">
      <textCharAction />
    </node>
    <node label="б">
      <textCharAction />
    </node>
    <node label="в">
      <textCharAction />
    </node>
    <node label="г">
      <textCharAction />
    </node>
    <node label="ґ">
      <textCharAction />
    </node>
    <node label="д">
      <textCharAction />
    </node>
    <node label="е">
      <textCharAction />
    </node>
    <node label="є">
      <textCharAction />
    </node>
    <node label="ж">
      <textCharAction />
    </node>
    <node label="з">
      <textCharAction />
    </node>
    <node label="и">
      <textCharAction />
    </node>
    <node label="і">
      <textCharAction />
    </node>
    <node label="ї">
      <textCharAction />
    </node>
    <node label="й">
      <textCharAction />
    </node>
    <node label="к">
      <textCharAction />
    </node>
    <node label="л">
      <textCharAction />
    </node>
    <node label="м">
      <textCharAction />
    </node>
    <node label="н">
      <textCharAction />
    </node>
    <node label="о">
      <textCharAction />
    </node>
    <node label="п">
      <textCharAction />
    </node>
    <node label="р">
      <textCharAction />
    </node>
    <node label="с">
      <textCharAction />
    </node>
    <node label="т">
      <textCharAction />
    </node>
    <node label="у">
      <textCharAction />
    </node>
    <node label="ф">
      <textCharAction />
    </node>
    <node label="х">
      <textCharAction />
    </node>
    <node label="ц">
      <textCharAction />
    </node>
    <node label="ч">
      <textCharAction />
    </node>
    <node label="ш">
      <textCharAction />
    </node>
    <node label="щ">
      <textCharAction />
    </node>
    <node label="ю">
      <textCharAction />
    </node>
    <node label="я">
      <textCharAction />
    </node>
    <node label="ʼ">
      <textCharAction />
    </node>
    <node label="ь">
      <textCharAction />
    </node>
  </group>
  <group name="Upper case" colorInfoName="upper case">
    <node label="А">
      <textCharAction />
    </node>
    <node label="Б">
      <textCharAction />
    </node>
    <node label="В">
      <textCharAction />
    </node>
    <node label="Г">
      <textCharAction />
    </node>
    <node label="Ґ">
      <textCharAction />
    </node>
    <node label="Д">
      <textCharAction />
    </node>
    <node label="Е">
      <textCharAction />
    </node>
    <node label="Є">
      <textCharAction />
    </node>
    <node label="Ж">
      <textCharAction />
    </node>
    <node label="З">
      <textCharAction />
    </node>
    <node label="И">
      <textCharAction />
    </node>
    <node label="І">
      <textCharAction />
    </node>
    <node label="Ї">
      <textCharAction />
    </node>
    <node label="Й">
      <textCharAction />
    </node>
    <node label="К">
      <textCharAction />
    </node>
    <node label="Л">
      <textCharAction />
    </node>
    <node label="М">
      <textCharAction />
    </node>
    <node label="Н">
      <textCharAction />
    </node>
    <node label="О">
      <textCharAction />
    </node>
    <node label="П">
      <textCharAction />
    </node>
    <node label="Р">
      <textCharAction />
    </node>
    <node label="С">
      <textCharAction />
    </node>
    <node label="Т">
      <textCharAction />
    </node>
    <node label="У">
      <textCharAction />
    </node>
    <node label="Ф">
      <textCharAction />
    </node>
    <node label="Х">
      <textCharAction />
    </node>
    <node label="Ц">
      <textCharAction />
    </node>
    <node label="Ч">
      <textCharAction />
    </node>
    <node label="Ш">
      <textCharAction />
    </node>
    <node label="Щ">
      <textCharAction />
    </node>
    <node label="Ю">
      <textCharAction />
    </node>
    <node label="Я">
      <textCharAction />
    </node>
    <node label="ʼ">
      <textCharAction />
    </node>
    <node label="Ь">
      <textCharAction />
    </node>
  </group>
  <group name="paragraphSpace" colorInfoName="paragraphSpace">
    <node label="¶" text="&#10;">
      <textCharAction />
    </node>
    <node label="␣" text=" ">
      <textCharAction />
    </node>
  </group>
  <group name="Editing" colorInfoName="editing">
    <node label="⌫">
      <deleteTextAction distance="last char" />
    </node>
    <node label="⌦">
      <deleteTextAction distance="next char" />
    </node>
    <node label="⌫ Word">
      <deleteTextAction distance="last word" />
    </node>
  </group>
</alphabet>